qid,sentid,question,sentence text,label
30,4,List the endoscopic diagnoses that have been reported in children with autism,The data support the hypothesis that LNH is a significant pathological finding in ASD children.,0
2737,1,Please list 7 classes of drugs that interact with Warfarin.,In patients receiving warfarin who also require NSAIDs,0
80,1,What is being measured with an accelerometer in back pain patients,Physical activity was measured for 7 days at both baseline and at 3 months with an RT3 accelerometer,0
1633,5,What are the major classes of retrotransposons active in the human genome?,"Only a few Alu elements are able to retropose, and the factors determining their retroposition capacity are poorly understood.",1
3048,12,Can pazopanib be used for treatment von Hippel-Lindau disease?,"METHODS
In this non-randomised, single-centre, open-label, phase 2 trial, adult patients with clinical manifestations of von Hippel-Lindau disease were recruited from the University of Texas MD Anderson Cancer Center (Houston, TX, USA) and were treated with pazopanib (800 mg orally daily) for 24 weeks, with an option to continue treatment if desired by the patient and treating physician.",0
1473,5,What is the typical rash associated with gluten ?,Dermatitis herpetiformis (DH) is an autoimmune blistering skin disorder that is associated with gluten sensitivity.,1
212,0,What is the clinical value of MammaPrint?,"In the intermediate-risk subgroup, the 70-gene signature could be useful to decide in elderly patients whether they may benefit from adjuvant chemotherapy or not.",0
385,2,What is the role of SERCA in diabetic cardiomyopathy?,"The expression of PKC, PLB increased significantly, while the PPI-1, SERCA-2 and RyR expression decreased.",0
1724,1,What colonoscopy findings have been reported in autism,There have been several reports of a link between autism and chronic gastrointestinal symptoms.,1
2016,14,Is ocular melanosis a risk factor for uveal melanoma?,"Risk factors so far identified include pre-existing choroidal naevi for uveal melanomas, primary acquired melanosis (PAM) for conjunctival tumours, and ocular and oculodermal melanocytosis for uveal and orbital lesions",0
3803,26,Is Tcf3 associated with the Wnt pathway?,T-cell factor 3 (Tcf3) is a component of the Wnt signaling and a dominant downstream effector in ESCs.,1
3809,36,Which type of pluripotency is Otx2 associated with?,The transcription factor Otx2 acts as a negative switch in the regulation of transition from naive to primed pluripotency in mouse pluripotent stem cells,1
4167,14,What is the function of the Eyeless associated gene in Drosophila?,Mammals hav,0
2870,9,What is CIBERSORT used for?,"The main limitations of this study are the use of diverse platforms for measuring gene expression, including some not previously used with CIBERSORT, and the combined analysis of different forms of follow-up across studies.",0
523,2,Is stop codon bypass possible?,Expression of retroviral replication enzymes (Pol) requires a controlled translational recoding event to bypass the stop codon at the end of gag.,0
1323,21,Do ephrins play a role in brain cancer?,"investigating the ephrinA1/EphA2 system in the pathobiology of glioblastoma multiforme (GBM), we uncovered that ephrinA1 is released from GBM and breast adenocarcinoma cells as a soluble",0
3447,1,List types of cancer where Long intergenic nonprotein coding RNA p53-induced transcript (LINC-PINT) is involved,We identify an 87-amino-acid peptide encoded by the circular form of the long intergenic non-protein-coding RNA p53-induced transcript (LINC-PINT) that suppresses glioblastoma cell proliferation in vitro and in vivo.,1
3359,9,Is the FIP virus thought to be a mutated strain for the Feline enteric Coronavirus?,Feline infectious peritonitis virus (FIPV) was presumed to arise from mutations in the 3c of a ubiquitous and largely nonpathogenic feline enteric coronavirus (FECV).,1
2454,2,Does the human lncRNA LINC-PINT promote tumorigenesis?,We find that LINC-PINT is downregulated in multiple types of cancer and acts as a tumor suppressor lncRNA by reducing the invasive phenotype of cancer cells.,1
2604,11,What is the link between lithium use during pregnancy and Ebstein anomaly?,Cross-sectional echocardiography was used to evaluate two neonates whose mothers ingested lithium during pregnancy.,0
1145,37,Could RG7112 be used as cancer therapy?,"Notably, RG7112 was highly synergistic with androgen deprivation in LNCaP xenograft tumors.",0
628,50,Tumor-treating fields are effective for treatment of which cancers?,Mitotic disruption and reduced clonogenicity of pancreatic cancer cells in vitro and in vivo by tumor treating fields.,0
3836,29,The NoSAS Score can be used for screening of which disorders?,"The sensitivity and specificity of NoSAS combined with improved Mallampati grading for screening OSA were 0.813 and 0.710, res",0
3703,7,Does radiotherapy for Hodgkin disease increases risk for lung cancer?,Increased risk of second lung cancer in Hodgkin's lymphoma survivors: a meta-analysis.,1
3287,18,Which bacteria causes rat bite fever?,Streptobacillus moniliformis is a fastidious growing Gram-negative bacillus responsible of rat-bite fever,0
2410,3,Is overproduction of transthyretin is associated with amyloidosis associated neuropathy?,"Hereditary transthyretin amyloidosis is an autosomal dominant inherited disorder, first described in families with sensorimotor and autonomic neuropathy.",1
3106,3,Which tool is used to visualise the junction sites of chloroplast genomes?,The software and its dependent libraries are fully coded in R and the reflected plot is scaled up to realistic size of nucleotide base pairs in the vicinity of the junction sites.,1
879,5,What is evaluated with the Hydrocephalus Outcome Questionnaire?,"In older children with hydrocephalus, the cHOQ appears to be a scientifically reliable means of assessing long-term outcome.",0
3587,5,Does Estrogen lead to forkhead FoxA1 activation?,"Furthermore, knockdown of FoxA1 expression blocks the association of ER with chromatin and estrogen-induced gene expression demonstrating the necessity of FoxA1 in mediating an estrogen response in breast cancer cells.",1
1555,11,Which are the state-of-the-art computational tools for the prediction of gene fusion events?,"Functional links between proteins can often be inferred from genomic associations between the genes that encode them: groups of genes that are required for the same function tend to show similar species coverage, are often located in close proximity on the genome (in prokaryotes), and tend to be involved in gene-fusion events.",1
211,14,Is long QT syndrome a cause for sudden cardiac death in athletes?,"Primary electrical disorders (such as the long QT syndrome) are rarely present in athletes but, so far, are a considerable reason for disqualification from sport activity.",0
757,3,Which are the major phycobiliproteins present in cyanobacteria?,C-Phycocyanin (C-Pc) is one of the major biliprotein pigments of unicellular cyanbacterium of Spirulina platenesis,1
1576,15,Which are the DNA (cytosine-5-)-methyltransferases inhibitors?,"The inhibitory activity of hydralazine toward DNMT may be rationalized at the molecular level by similar interactions within the binding pocket (e.g., by a similar pharmacophore) as established by substrate-like deoxycytidine analogues.",0
972,37,What are the computational methods for the prediction of beta-barrel transmembrane proteins?,"Finally, ANN- and SVM-based methods were combined to utilize the full potential of both techniques.",0
837,7,Are defects in recombination repair involved in carcinogenesis?,olymorphisms in DNA repair genes and differences in repair capacity between individuals have been widely documented.,0
144,14,What is the COUGER tool?,"COUGER takes as input two sets of genomic regions bound by paralogous TFs, and it identifies a small set of putative co-factors that best distinguish the two sets of sequences.",0
3574,51,Which gene is frequently involved in autosomal dominant adult-onset demyelinating leukodystrophy (ADLD)?,"While at least a dozen disorders are associated with LMNA, the focus of this review is Autosomal Dominant Leukodystrophy (ADLD), the only disease associated with the lamin B1 gene (LMNB1).",0
1159,0,What is Trypan blue used for?, cell death by trypan blue exclusion assay,1
1560,1,Which molecule is targeted by a monoclonal antibody Secukinumab?,"Their potencies were comparable to those of known neutralizing antibodies, including 2, AIN457 (secukinumab) and ixekizumab that are currently in clinical development for the treatment of various inflammatory disorders.",0
1813,7,What are the SINEUPs?,"We propose SINEUPs as reagents for molecular biology experiments, in protein manufacturing as well as in therapy of haploinsufficiencies",0
806,34,Which enzyme is involved in the maintenance of DNA (cytosine-5-)-methylation?,New genetic studies in plants and mammals have identified a novel factor that increases the fidelity of maintenance methylation.,0
3578,7,What is PRL3-zumab?,"In summary, our results document a comprehensive cancer therapeutic approach to specific antibody-targeted therapy against the PRL-3 oncotarget as a case study for developing antibodies against other intracellular targets in drug discovery.",0
2197,3,Is Pfh1 a component of the replisome?,"DNA replication through hard-to-replicate sites, including both highly transcribed RNA Pol II and Pol III genes, requires the S. pombe Pfh1 helicase.",1
2555,12,Describe RIblast,RIblast: an ultrafast RNA-RNA interaction prediction system based on a seed-and-extension approach.,0
1925,0,Which disease the London mutation involved in?,"In the present study, we used a new training paradigm in the intelliCage automatic behavioral assessment system to investigate cognitive functions of the transgenic mice harboring London mutation of the human amyloid precursor protein (APP.V717I).",0
3699,27,What is the use of erenumab?,Erenumab in the treatment of migraine.,0
96,5,What is the application of the Bimolecular Fluorescence Complementation (BiFC) assay in Drosophila embryos?,The bimolecular fluorescence complementation (BiFC) technology offers this possibility as it enables the direct visualization of protein interactions in living cells.,0
1542,0,Is thyroid hormone therapy indicated in patients with heart failure?,Patients with chronic heart failure and subclinical hypothyroidism significantly improved their physical performance when normal TSH levels were reached.,1
1947,25,What is the purpose of the Orpington Prognostic Scale?,To provide recovery rates after stroke for specific functions using the Orpington Prognostic Scale (OPS).,0
1840,50,What is the function of Oseltamivir when administered during flu?,"According to one trial, oseltamivir was moderately effective as a prophylactic for close contacts of 'flu cases (6.6% in absolute values).",0
4144,3,Which particular intersex phenotype is related to steroid reductase?,"It is also imperative to establish whether defects in steroid 5 alpha-reductase 2, perhaps in the heterozygous state, are responsible for a portion of cases of sporadic hypospadias, to determine whether 5 alpha-reductase plays a role in progesterone action in women, and to elucidate the relation between androgen action and gender role behavior.",0
2668,2,Is the protein pelota a ribosomal rescue factor?,"In eukaryotes, the protein complex of Pelota (yeast Dom34) and Hbs1 translational GTPase recognizes the stalled ribosome containing the defective mRNA.",1
1214,26,"Which gene fusion is the result of the ""philadelphia translocation"" or the ""philadelphia chromosome"" mutation?","Chronic myeloid leukemia (CML) is characterized by formation of the BCR-ABL fusion gene, usually as a consequence of the Philadelphia (Ph) translocation between chromosomes 9 and 22",0
3843,13,Which chromosome contains the TLR7 locus in the human genome?,"TLR7 is encoded by an X chromosome locus, and we examined here whether the TLR7 gene evades silencing by X chromosome inactivation in immune cells from women and Klinefelter syndrome males.",0
12,10,Which are the different isoforms of the mammalian Notch receptor?,"However, Notch-3 expression appeared to be increased in diseased tissue.",0
3489,8,Can radiation induced meningiomas be treated with radiosurgery?,Stereotactic radiosurgery for radiation-induced meningiomas.,0
1290,17,which are the risk factors for sudden cardiac death in patients with hypertrophic cardiomyopathy?,The following risk factors were analyzed: 1) previous cardiac arrest or sustained ventricular tachycardia; 2) family history of sudden cardiac death; 3) high-risk genetic mutations; 4) syncope; 5) non-sustained ventricular tachycardia; 6) hypotensive response to exercise; and 7) marked left ventricular hypertrophy.,1
1302,0,Does thyroid hormone signaling affect microRNAs expression in the heart?,"e show that the heart regulates systemic energy homeostasis via MED13, a subunit of the Mediator complex, which controls transcription by thyroid hormone and other nuclear hormone receptors.",1
2330,20,Is DNA methylation correlated with nucleosome occupancy?,"Transcription, histone modifications, and DNA methylation alter this ""ground state"" by having distinct effects on both nucleosome positioning and occupancy.",0
1162,23,List features of the DEND syndrome.,"Approximately 20% have associated neurologic features: the most severe form, which includes epilepsy and developmental delay, is called developmental delay, epilepsy, and neonatal diabetes (DEND) syndrome and the milder form, with less severe developmental delay and without epilepsy, is designated intermediate DEND syndrome.",0
3451,4,Which molecule is targeted by Asciminib?,"Discovery of Asciminib (ABL001), an Allosteric Inhibitor of the Tyrosine Kinase Activity of BCR-ABL1.",1
4227,57,What conditions are diagnosed using the scratch collapse test?,"PURPOSE: To clarify the sensitivity, specificity, and interrater reliability of the scratch collapse test for carpal tunnel syndrome (CTS) and cubital tunnel syndrome, using blinded observers in a general patient population.METHODS: Ninety-two subjects were recruited from all patients referred for electrodiagnostic studies for upper extremity symptoms that were thought to be related to an entrapme",0
1266,4,Which type of genes are modulated by SATB1?,"Consistent with previous reports in a non-superantigen in vivo anergy model, mRNA for CD18 and the transcription factor Satb1 (special AT-rich-binding protein 1) was increased in SEB-energized T cells.",1
1690,4,Is the JNK pathway activated during liver regeneration?,initial activity of the JNK pathway,0
3718,17,Are there negative enhancers?,We have previously identified a silencer (negative enhancer) in glutathione transferase P (GST-P) gene which is strongly and specifically induced during hepatocarcinogenesis of the rat.,0
126,54,"What are 'vildagliptin', 'sitagliptin', 'saxagliptin', 'alogliptin', 'linagliptin', and 'dutogliptin'?","A systematic review and meta-analysis of randomised controlled trials (RCTs) of DPP-4 inhibitors (vildagliptin, sitagliptin, saxagliptin, linagliptin and alogliptin) on HbA1c were conducted.",0
1086,6,"Carbapenemase-producing gram-negative bacteria is a major health concern because their resistance to antibiotics.
List the most frequent carbapenemases found in Enterobacteriaceae.","Producers of IMP-, VIM-, and KPC-type carbapenemases with high levels of resistance to cephalosporins and to carbapenems were detected at 1x10(1) CFU/ml.",0
3812,18,Can secondary glioblastoma be caused by brain irradiation?,Report of 3 cases.,0
3770,1,Describe the mechanism of action of pitolisant.,"Whilst all of the compounds tested displayed robust histamine H3 receptor inverse agonism and did not differentiate between the main H3 receptor splice variants, they displayed a wide range of affinities and kinetic properties, and included rapidly dissociating (pitolisant, S 38093-2, ABT-239) and slowly dissociating (GSK189254, JNJ-5207852, PF-3654746) agents.",0
124,6,Is DITPA a thyroid hormone analog utilized in experimental and clinical studies," Moreover, DITPA and T(4) were efficacious in preventing effects of hypothyroidism on cardiac function and BVD",1
1929,14,Can NADPH oxidase be inhibited by apocynin and diphenylene iodonium?,"In addition, inhibitors of NADPH oxidase (diphenylene iodonium or apocynin) also prevented microglia proliferation, suggesting that this may be the source of hydrogen peroxide.",0
4131,2,Can Panitumumab cause trichomegaly?,Elongation of the eyelashes induced by these agents has predominantly been observed in oncology patients with either colorectal or lung cancer.,1
2271,1,Is davunetide being considered for the treatment of progressive supranuclear palsy?,"Davunetide's efficacy and tolerability are being tested in a placebo-controlled study in PSP patients, making it the most advanced drug candidate in this indication.",1
1350,12,"Which are the bioinformatics tools for gene structure prediction?
",Source code for the updated versions of GeneSeqer and SplicePredictor (distributed with the GeneSeqer code) isavailable at http://bioinformatics.iastate.edu/bioinformatics2go/gs/download.html.,0
1718,5,How many and which are the different isoforms for the ryanodine receptor?,In excitable cells such as skeletal and cardiac myocytes excitation-contraction coupling is an important intermediate step between initiation of the action potential and induction of contraction.,0
141,18,What is Genomicus?,Genomicus (http://www.dyogen.ens.fr/genomicus/) is a database and an online tool that allows easy comparative genomic visualization in >150 eukaryote genomes.,0
1368,28,Which pharmacogenetic test is available for abacavir?,Results were also sensitive to the cost of HLA-B*5701 testing and the prevalence of HLA-B*5701.,1
543,13,Is the gene DUX4 epigenetically regulated in somatic cells?,"Recent studies provide compelling evidence that a retrotransposed gene in the D4Z4 repeat, DUX4, is expressed in the human germline and then epigenetically silenced in somatic tissues.",1
3242,21,What is the Triad of Alport Syndrome?,"Alport syndrome is a rare condition characterized by the clinical triad of nephritic syndrome, sensorineural deafness, and ophthalmological alterations.",1
2731,17,What biologic process in the body is associated with Mast cells?,"Several chronic inflammatory diseases are associated with increased mast cell numbers and upregulation of the TNF receptor family member CD30, but the role of elevated CD30 expression is poorly understood.",0
2425,10,Are there mammalian promoters with distal enhancer functions?,genome wide characterization of mammalian promoters with distal enhancer functions,0
1110,11,Describe Malgaigne fracture.,Twenty-six of the thirty-two cadavera that were examined radiographically and dissected had a double break in the pelvic ring (Malgaigne pattern).,0
4080,50,Which cytokine molecule activates SMADs?,Mutational studies coupled with knockdown experiments have shown that TGF-β1-induced Necl-2 repression requires activation of Smad proteins.,0
2147,14,What is MPE-seq?,These findings collectively indicate that MPE-seq provides a unique and straightforward means for the genome-wide analysis of chromatin structure with minimal DNA sequence bias.,0
4137,24,How is Burke-Fahn-Marsden Dystonia scale used?,Background: The Burke-Fahn-Marsden Dystonia Rating Scale is a universally applied instrument for the quantitative assessment of dystonia in both childre,0
364,8,Is alemtuzumab effective for remission induction in patients diagnosed with T-cell prolymphocytic leukemia?,"With the introduction of alemtuzumab, most patients who progressed despite treatment with pentostatin had a major response with a complete remission rate higher than that obtained with pentostatin when used as a first line.",0
1702,3,PBT2 has been tested for which disorder?,"The purpose of this mini-review is to highlight the emerging notion that metal chaperones, such as PBT2 (Prana Biotechnology), modulate a variety of critical pathways affecting key aspects of the AD cascade to provide a more ""holistic"" approach to the treatment of this disease.",0
1236,30,Is there any cross-talk between the Wnt and the Akt pathways?,Here we show that DEX inhibition of the differentiation-related cell cycle is associated with a decrease in beta-catenin levels and inhibition of LEF/TCF-mediated transcription.,0
2946,0,What is the cause of Sandhoff disease?,"Sandhoff disease (SD) is a genetic disorder caused by a mutation of the β-subunit gene β-hexosaminidase B (HexB) in humans, which results in the massive accumulation of the ganglioside GM2 and related glycosphingolipids in the nervous system.",1
1560,18,Which molecule is targeted by a monoclonal antibody Secukinumab?,"Th-17A antagonism has been investigated by a randomized controlled trial in PsA patients with secukinumab, a fully human, high-affinity, monoclonal antibody in a cohort of patients with active PsA.",0
1719,3,Which compound is a specific inhibitor for Nox1 and Nox4?,Basal NAD(P)H oxidase activity was blocked by GKT136901 (Nox1/4 inhibitor) and by Nox1 siRNA in WKY cells and by siNOX1 and siNOX2 in SHR.,0
2379,7,Are loop domains preserved upon cohesin loss?,cohesin loss eliminates all loop domains,1
2899,0,Briefly describe a deep learning system that is more accurate than human experts at detecting melanoma.,Computer-aided diagnosis systems powered by convolutional neural networks (CNNs) can improve diagnostic accuracy and save lives.,1
1857,15,What is the function of transthyretin in cerebrospinal fluid?,Thyroid hormones enter the choroid plexus via thyroid hormone transmembrane transporters and leave the choroid plexus to enter the cerebrospinal fluid via either thyroid hormone transmembrane transporters or via choroid plexus-derived transthyretin secreted into the cerebrospinal fluid.,0
565,1,Is the long non- coding RNA malat-1 up or downregulated in cancer?,Metastasis-Associated-in-Lung-Adenocarcinoma-Transcript-1 (MALAT-1) is an ncRNA that is highly expressed in several tumor types,1
991,14,What is the role of venous angioplasty in multiple sclerosis?,There are clinical trials ongoing or planned to treat chronic cerebrospinal venous insufficiency (CCSVI) through angioplasty.,0
2006,18,Which diseases are associated with Primary intestinal lymphangiectasia (PIL)?,"Primary intestinal lymphangiectasis (PIL), also known as Waldmanns disease, is a rare protein-losing enteropathy characterized by abnormal enlargement of the lymphatic ducts in the bowel wall",0
2366,21,Which virus can be diagnosed with the monospot test?,Sera negative for the markers of both viruses: Hepatitis A (HAV) and Hepatitis B (HBV) were subsequently tested for IGM Heterophil antibodies against Epstein-Barr virus (EBV) by the Monospot slide test to diagnose acute infectious mononucleosis and tested for anti-CMV (IgM) by ELISA technique for the diagnosis of acute Cytomegalovirus (CMV) infection.,1
3534,10,Is Huntington's disease caused by a dominate or recessive gene?,Huntington disease is an autosomal-dominant neurodegenerative disease of mid-life onset caused by expansion of a polymorphic trinucleotide (CAG) repeat.,0
2229,12,Does PCSK9 (Proprotein convertase subtilisin/kexin type 9) binds with HDL-receptor (HDL-R)?,"Proprotein convertase subtilisin/kexin type 9 (PCSK9) binds to LDL receptors, leading to their degradation",1
2996,18,Which methods have been developed for extracting sequence variants from the literature?,"Here, we report tmVar, a text-mining approach based on conditional random field (CRF) for extracting a wide range of sequence variants described at protein, DNA and RNA levels according to a standard nomenclature developed by the Human Genome Variation Society.",0
493,15,Which disease is included as an additional feature in the Goldberg-Shprintzen syndrome?,Marfanoid phenotype with craniosynostosis (Shprintzen-Goldberg syndrome) is a rare disorder previously described in only 5 patients.,0
3745,20,Variants in which genes cause nonsyndromic retinal degeneration?,An allelic hierarchy was observed in the discovery cohort and confirmed in the replication cohort.,0
524,4,Is the protein β1-integrin recycled?,CycD1 overexpression increased β1 integrin recycling,1
4113,16,Which drugs are included in the VAC regiment for Ewing's sarcoma?,"VAC (vincristine, actinomycin D, and cyclophosphamide) regimens with anthracyclines resulted in better survival.",1
765,12,List available methods for transmembrane protein topology prediction.,"The method achieves topology prediction accuracy of 89%, while signal peptides and re-entrant helices are predicted with 93% and 44% accuracy respectively.",0
1467,39,Are BRAF mutations common in melanoma?,BRAF represents one of the most frequently mutated protein kinase genes in human tumours.,0
2479,30,Which R packages have been developed for the discovery of mutational signatures in cancer?,"The results illustrate several important features of our methods, including the ability of our new visualization tool to clearly highlight the key features of each signature, the improved robustness of signature inferences from small sample sizes, and more detailed inference of signature characteristics such as strand biases and sequence context effects at the base two positions 5' to the mutated site.",0
1920,22,What is clinical presentation of the Gardner-Diamond syndrome?,Gardner-Diamond syndrome (GDS) is an uncommon disease clinically characterized by a wide spectrum of psycho-emotive symptoms associated with painful ecchymoses/purpuric lesions and positivity of auto-erythrocyte sensitization skin test.,0
203,15,What is the genetic basis of tuberous sclerosis?,Molecular genetic basis of renal carcinogenesis in the Eker rat model of tuberous sclerosis (Tsc2),0
