qid,sentid,question,sentence text,label
1901,2,Is there any role for Pds5b in cohesion establishment?,"While both proteins contribute to telomere and arm cohesion, Pds5B is specifically required for centromeric cohesion.",0
757,26,Which are the major phycobiliproteins present in cyanobacteria?,I.,0
656,11,What symptoms characterize the Muenke syndrome?,Unilateral coronal synostosis results in anterior plagiocephaly (asymmetry of the skull and face).,0
1562,3,Is abdominal pain a common symptom in autism?,"Children with autism spectrum disorders (ASD) experience high rates of anxiety, sensory processing problems, and gastrointestinal (GI) problems",0
2037,15,Which virus type causes Molluscum contagiosum?,Molluscum contagiosum (MC) is a very common benign self-limiting cutaneous viral infection caused by molluscum contagiosum virus,0
49,7,Are ultraconserved elements often transcribed?,"Although the nature of these transcripts remains a mistery, our meta-analysis of RNA-Seq datasets indicates that they are unlikely to be short RNAs and that some of them might encode nuclear transcripts",0
2343,21,List main clinical features of the POEMS syndrome.,"The POEMS (polyneuropathy, organomegaly, endocrinopathy, monoclonal gammapathy, and skin changes) syndrome is a rare variant of plasma cell dyscrasia with multisystemic manifestations.",0
4028,47,"What does ""28"" stand for in the Disease Activity Score DAS28?","Disease activity assessment of rheumatoid arthritis in daily practice: validity, internal consistency, reliability and congruency of the Disease Activity Score including 28 joints (DAS28) compared with the Clinical Disease Activity Index (CDAI).",0
1423,17,What are the breath test biomarkers of pulmonary tuberculosis,Breath VOCs contained apparent biomarkers of active pulmonary tuberculosis comprising oxidative stress products (alkanes and alkane derivatives) and volatile metabolites of M.,1
1299,35,"Which tumor suppressor is referred to as ""the guardian of the genome""?",The tumor suppressor protein p53 is often referred to as the guardian of the genome,0
4203,8,Does AZD3759 cross the blood brain barrier?,sing class of EGFR TKI such as AZD3759 has been designed to penetrate blood brain barrier to treat brain metastases and leptomeningeal disease and has showed promising responses in patients with brain metastases.,0
694,13,Is there a phylogenetic analysis for HIV?," (HIV-1) dual infection (DI) has been associated with decreased CD4 T-cell counts and increased viral loads; however, the frequency of intrasubtype DI is poorly understood.",0
2479,12,Which R packages have been developed for the discovery of mutational signatures in cancer?,"Results on real data agree well with current knowledge.AVAILABILITY AND IMPLEMENTATION: signeR is implemented in R and C ++, and is available as a R package at http://bioconductor.org/packages/signeR",0
4021,1,Please list the 2 vaccines for herpes zoster(shingles),"Two different vaccines have been developed to prevent HZ; one is based on a live attenuated VZV strain (Zostavax), and the other is based on adjuvanted gE recombinant protein (Shingrix).",0
110,6,Is there a genetic component for happiness?,The heritability of happiness was estimated at 22% for males and 41% in females.,1
1853,9,Could hypophosphatemic rickets cause craniosynostosis?,"In XLHR, only few case reports of craniosynostosis were described.",0
3369,5,What is GeneCodeq?,Our approach can also be combined with existing lossy compression schemes to further reduce entropy and allows the user to specify a reference panel of expected sequence variations to improve the model accuracy.,1
226,8,Which protein is the E3-ubiquitin ligase that targets the tumor suppressor p53 for proteasomal degradation?,"p53 is inactivated in many human malignancies through missense mutations or overexpression of the human homologue of Mdm2 (Hdm2), an E3 ubiquitin ligase that ubiquitinates p53, thereby promoting its proteasomal degradation.",1
1833,14,What do statins do?,"This study was undertaken to investigate the immunomodulatory mechanisms of statins that target the IFN response in PDCs.We isolated human blood PDCs by flow cytometry and examined the effects of simvastatin and pitavastatin on PDC activation, IFNalpha production, and intracellular signaling.Statins inhibited IFNalpha production profoundly and tumor necrosis factor alpha production modestly in human PDCs in response to Toll-like receptor ligands",0
1844,24,What is the role of the UBC9 enzyme in the protein sumoylation pathway?,"Here we have identified host cell proteins involved with the cellular SUMOylation pathway, SUMO-1 (small ubiquitin-like modifier) and UBC9, a SUMO-1 conjugating enzyme that interact with classical swine fever virus (CSFV) Core protein",0
2164,11,Which is the most common gene signature in Rheumatoid Arthritis patients?,The 256 genes identified were used to derive a gene signature score by averaging their log expression within each patient.,0
1383,26,Is there an association between c-reactive protein concentrations and outcomes of subarachnoid hemorrhage patients? ,"CONCLUSIONS: Serum levels of ICAM-1, VCAM-1 and hsCRP during the early and late period following SAH correlate with DIND",0
444,15,What is the percentage of responders to tetrabenazine treatment for dystonia in children?,Transient improvement was achieved with tetrabenazine and baclofen,0
1279,13,Which could be some of the possible causes of hypersomnia?,"Sleep apnea syndrome (SAS), narcolepsy, chronic sleep deprivation (insufficiency), and restless legs/periodic limb movements in sleep syndrome (RLS/PLMS) represent the most common causes of hypersomnia.",0
3689,19,Which receptor is modulated with Siponimod?,"Discovery of BAF312 (Siponimod), a Potent and Selective S1P Receptor Modulator.",0
584,4,What is the main component of the Lewy bodies?,Parkinson's disease (PD) is characterized by the progressive degeneration of substantia nigra pars compacta (SNpc) dopaminergic neurones and the formation of Lewy bodies (LB) in a proportion of the remaining neurones.,1
1090,13,What is STARR-seq?,"This map reveals the highly complex regulation of transcription, with several independent enhancers for both developmental regulators and ubiquitously expressed genes.",0
71,11,Which human genes are more commonly related to craniosynostosis?,These results suggest that Nell-1 is likely a downstream target of Runx2,0
1716,19,Is the PTPN22 gene a biomarker for Rheumatoid Arthritis?,"These genes include PTPN22, TRAF1-C5, PADI4, STAT4",0
2767,6,Which organs are mostly affected in Systemic Lupus Erythematosus (SLE)?,Cutaneous lupus erythematosus (CLE) includes skin symptoms seen in SLE and cutaneous-limited LE.,0
1815,23,What is the mechanism of action of raxibacumab?,Raxibacumab provides additional protection against inhalational anthrax via a mechanism different from that of either antibiotics or active immunization.,0
2496,12,Does prolactinoma increase osteoporosis risk?,"CONCLUSION: In the premenopausal women, patients with prolactinoma or craniopharyngioma are often accompanied with osteopenia or osteoporosis, and disease duration and hypogonadism are the risk factors of bone loss in prolactinoma.",0
476,9,Is Rheumatoid Arthritis more common in men or women?,"Likewise, HAQ and VAS pain were rated significantly higher in women.",0
1218,2,Which type of lung cancer is afatinib used for?,"At present, only first-generation EGFR-tyrosine kinase inhibitors (TKIs) (erlotinib and gefitinib) are available for clinical use.",0
4202,3,Which protein is encoded by the protein APOBEC3C?,"apolipoprotein B mRNA-editing enzyme catalytic subunit 3C (APOBEC3C, a nucleic acid-editing deaminase)",1
1886,30,Which mutated gene is associated with Waardenburg and Tietz syndromes?,Mutations in the MITF have been found in patients with the dominantly inherited hypopigmentation and deafness syndromes Waardenburg syndrome type 2A (WS2A) and Tietz syndrome (TS).,0
3593,0,What is the cause of the disease Xeroderma Pigmentosum?,ERCC4 (XPF) encodes a protein that forms a complex with ERCC1 and is required for the 5' incision during nucleotide excision repair.,1
231,12,Do orphan and gene related CpG islands follow power-law-like distributions?,In both cases power-law-like linearity in double logarithmic scale is found.,0
1575,14,Which diseases can Oncotype DX be used for?,The Oncotype DX Recurrence Score (RS) is a validated genomic predictor of outcome and response to adjuvant chemotherapy in ER-positive breast cancer.,0
4055,3,Is progeria caused by an autosomal recessive gene?,I,0
1717,11,Is marijuana use associated with increased risk for stroke?,"We here describe 2 young patients (26 and 29 years, respectively) who suffered from ischemic stroke in temporal relation with cannabis consumption.",0
38,7,Does physical activity influence gut hormones?,Acylated ghrelin was lowest in the afternoon of SIE (P = 0.018) despite elevated appetite,0
4009,11,Why are male calico cats rare?,"he physical characteristics which suggested an abnormality of chromosome number in cats were ""calico"" or ""tortoise-shell"" coat colors in a male.",0
4027,13,Explain the use of Radio Frequency Ablation as a treatment,SIONS: Minimally invasive sonographically guided radio frequency thermal ablation is technically feasible for local treatment of unresectable recurrent retroperitoneal and pelvic tumors from different origins.,0
777,11,Which pituitary adenoma is common cause of infertility is women?,"Of the remaining six patients who had been investigated for infertility, no demonstrable cause of infertility was found in three.",0
1544,14,Could Hyperthermic intraperitoneal chemotherapy (HIPEC) be effective for the treatment of recurrent ovarian cancer?," The results of our study indicate the feasibility and the potential benefit of a protocol including systemic chemotherapy, surgical cytoreduction and HIPEC in patients with peritoneal carcinomatosis from ovarian cancer.",0
476,10,Is Rheumatoid Arthritis more common in men or women?,"432 females, 125 males",0
15,28,Is the monoclonal antibody Trastuzumab (Herceptin) of potential use in the treatment of prostate cancer?,We conclude that Her2/neu expression in the peripheral blood mononuclear cell fraction of prostate cancer patients is frequent and therefore this assay may potentially be useful to detect the presence of micrometastatic disease in men with prostate cancer and for monitoring patients enrolled in trastuzumab-based therapeutic protocols.,0
1494,14,What is the role of the Ada O6-alkylguanine alkyltransferase in bacteria?,"The Ada protein acts both as a positive regulator of the response and as a DNA repair enzyme, correcting premutagenic O6-alkylguanine in DNA by suicidal transfer of the alkyl group to one of its own cysteine residues.",1
485,21,What is the gene mutated in the Gaucher disease?,mutated glucocerebrosidase alleles of Portuguese type 1 Gaucher patients,0
1965,7,Is butterfly rash a symptom of Systemic lupus erythematosus?,"The prevalence of the following manifestations was significantly higher for pediatric than for adult-onset disease including: lupus nephritis (43% pediatric vs 26.4% for adult-onset), hematological disorders (57% vs 36.4%), photosensitivity (20% vs 9%), butterfly rash (61% vs 35.5%) and mucosal ulceration (11.4% vs 4%).",0
1446,27,Describe Heyde syndrome.,"Heyde syndrome is described as the association of arteriovenous malformations (AVMs) of the gastrointestinal tract and aortic stenosis (AS); its existence,",1
839,14,Are seizures among the neurological symptoms of incontinentia pigmenti?,"Several clinical presentations could be identified, comprising seizures, infantile encephalopathy, acute disseminated encephalomyelitis and ischemic stroke",0
4061,16,Is acupotomy used to treat muscle stiffness?,Both acupotomy and acupuncture have been widely used clinically to treat CSR in China with satisfied efficacy.,0
1973,0,Which are the main brain dysfunctions caused by hyperbilirubinemia?,Bilirubin-induced neurologic dysfunction (BIND) and classical kernicterus are clinical manifestations of moderate to severe hyperbilirubinemia whenever bilirubin levels exceed the capacity of the brain defensive mechanisms in preventing its entrance and cytotoxicity.,1
354,7,What is membrane scission?, Force produced by actin similarly contributes in membrane scission in endocytosis or Golgi remodeling.,0
507,1,How early during pregnancy does non-invasive cffDNA testing allow sex determination of the fetus?,We determined fetal sex during the first trimester using a quantitative real-time polymerase chain reaction (PCR) assay of cffDNA in pregnant carriers of DMD.,0
1798,35,"What is the ""wearing-off"" phenomenon in levodopa-treated patients with Parkinson's Disease?","It is unlike the ""wearing-off"" phenomenon that occurs when dopaminergic drug levels decline and responds to dopaminergic rescue drugs.",0
1352,20,What is the correlation between SPARC expression and growth inhibition in human cancer?,"Finally, we demonstrated that SPARC, which has been previously associated with meningioma invasiveness, was increased in aggressive meningiomas.",0
3053,19,Which enzyme is deficient in Wolman disease?,Molecular defects underlying Wolman disease appear to be more heterogeneous than those resulting in cholesteryl ester storage disease.Human lysosomal acid lipase/cholesteryl ester hydrolase (hLAL) is essential for the intralysosomal metabolism of cholesteryl esters and triglycerides taken up by receptor-mediated endocytosis of lipoprotein particles.,0
4080,46,Which cytokine molecule activates SMADs?,"We here review the role of TGF-β1 and Smad7 in intestinal immunity, inflammation, and cancer.",0
2289,7,How are topologically associating domains (TAD) associated with replication timing?,Hi-C also segregates inter-TAD contacts into defined 3D spatial compartments that align precisely to genome-wide replication timing profiles.,0
121,4,List genes that have been found mutated in CMT1A (Charcot-Marie-Tooth disease type 1 A).,Many PMP22 mutants accumulate in excess in the endoplasmic reticulum (ER) and lead to the inherited neuropathies of Charcot-Marie-Tooth (CMT) disease.,0
3334,22,List characteristic features of the Revesz syndrome.,"The findings of myelofibrosis , retinopathy , and cerebral calcifications indicate that this could be a case of a rare condition known as Revesz syndrome .",0
2556,1,What is Alzheimers disease resilience?,Memory resilience occurs when genetically at-risk adults perform at high and sustained levels.,0
2041,8,List 3 indications for Bupropion,"Clinically, bupropion is used as a treatment for two indications, as an antidepressant, the indication for which it was developed, and as a tobacco use cessation agent",1
384,8,Is nintedanib effective for Idiopathic Pulmonary Fibrosis?,"Most recently, pirfenidone and nintedanib, two compounds with pleiotropic anti-fibrotic properties, have been proven effective in reducing functional decline and disease progression in IPF.",0
2604,32,What is the link between lithium use during pregnancy and Ebstein anomaly?,"No women who took lithium during pregnancy were found among four case-control studies of Ebstein's anomaly involving 25, 34, 59, and 89 affected children, respectively.",0
3722,9,What is the role of STAG1/STAG2 proteins in differentiation?,"In all cases, we observed that the simultaneous blocking of STAG1 and STAG2 significantly reduces cell proliferation.",1
1828,27,Is Migalastat used for treatment of Fabry Disease?,migalastat for Fabry disease) and inhibitors of glucosylceramide synthesis (e.g.,0
1853,30,Could hypophosphatemic rickets cause craniosynostosis?,INTRODUCTION TO THE OPHTHALMIC LITERATURE OF AN UNUSUAL CAUSE OF PAPILLEDEMA AND SUBSEQUENT OPTIC ATROPHY: X-linked hypophosphatemic rickets (XLH).Case report of a 3-year-old female presenting with papilledema resulting from craniosynostosis secondary to XLH.Early intervention with craniofacial surgery prevented the development of optic atrophy.Children with XLH should be screened for ophthalmic evidence of elevated intracranial pressure to aid early intervention and prevention of permanent loss of vision,0
2428,3,Is autosomal dominant inheritanced form of Osteogenesis imperfecta caused by mutations in the genes associated with collagen production?,The majority of OI cases have an autosomal dominant pattern of inheritance and are usually caused by mutations in genes encoding type I collagen,0
1174,18,Which depression rating scales were shown to have acceptable psychometric properties for screening of poststroke depression?,"The proportion of patients correctly identified as depressed by the test (sensitivity) when rated by nurses was 64%, and the proportion of patients not depressed who were correctly identified by the test (specificity) was 61%, whereas carers achieved sensitivity 90% and specificity 35%.",0
4103,1,Explain amniotic band syndrome.,Amniotic band syndrome is a rare congenital disorder caused by entrapment of fetal parts (usually a limb or digits) in fibrous amniotic bands while in utero that presents with complex multisystem anomalies.,1
435,6,What is the molecular function of psoralen photobinding on DNA?,"The crystal and molecular structure of 4,4&apos;,5&apos;-trimethylazapsoralen, obtained by X ray diffraction, was also reported.",0
3529,8,Are CD8+ (cytotoxic) T cells and  CD4+ Helper T cells generated in the thyroid and express the T-cell receptor?,"In the thymus, immature CD8(-4)-TCR- cells differentiate, possibly via a short stage of CD8+4- thymocytes, into CD8+4+ TCR+ T cells and mature further into the main T cell populations, the CD8+4- TCR+ cytotoxic T lymphocytes and the CD4+8- TCR+ T helper cells.",1
2353,15,What is the function of the H19 (ICR) locus in the human genome?,Mouse/human sequence divergence in a region with a paternal-specific methylation imprint at the human H19 locus.,0
2612,9,Please list 6 symptoms of Scarlet fever.,") SI with a pronounced generalization including a pharyngeal one (31 cases), 4 of them with a rash (scarlet fever); extrapharyngeal (7 cases), 6 of them with a rash (scarlet fever); 2) SI without pronounced generalization (localized) including 33 cases with the involvement of the lungs and tonsilla and having an ordinary course and 11 cases of a sudden death.",1
2148,22,Describe the mechanism of action of Bezlotoxumab?,We also show that bezlotoxumab neutralizes TcdB by blocking binding of TcdB to mammalian cells.,0
1330,14,What is the definition and the biological role of epithelial-mesenchymal transition (EMT),This term is used to describe the mechanisms facilitating cellular repositioning and redeployment during embryonic development and tissue reconstruction after injury.,0
509,28,Is phospholamban a regulatory/inhibitory protein of the Ca ATPase SERCA?,"We used EPR spectroscopy to probe directly the interaction between phospholamban (PLB) and its regulatory target, the sarcoplasmic reticulum Ca-ATPase (SERCA)",0
2471,13,Describe King–Kopetzky syndrome.,The main reported disability is hearing speech in the presence of background noise.,0
633,23,What is the main role of Ctf4 in dna replication?,"Using in vivo RNAi knockdown of CTF4 in Drosophila we show that Ctf4 is required for viability, S phase progression, sister chromatid cohesion, endoreplication, and coping with replication stress.",0
1572,19,What is the role of eteplirsen in DMD patients?,The present study used a double-blind placebo-controlled protocol to test eteplirsen's ability to induce dystrophin production and improve distance walked on the 6-minute walk test (6MWT).,0
1585,3,Can Preimplantation Genetic Diagnosis (PGD) be used for gender selection?,"In this study, the analysis of a large series of PGD procedures for gender selection from a wide geographical area in the USA shows that, in general, there is no deviation in preference towards any specific gender except for a preference of males in some ethnic populations of Chinese, Indian and Middle Eastern origin that represent a small percentage of the US population.",0
3257,9,List symptoms of the One-and-a-half syndrome.,We report a unique neuroophthalmological syndrome consisting of vertical one-and-a-half syndrome-resulting from a combination of supranuclear conjugate upgaze palsy associated with left infranuclear (fascicular) third nerve involvement (Weber syndrome)-with concomitant contralesional pseudo-abducens palsy.,0
1109,4,Which glands are subject to attack by lymphocytes in Sjogren's syndrome?,"Sjögren's syndrome (SjS) is a systemic autoimmune disease in which an immunological attack against the salivary and lacrimal glands results, respectively, in severe dry mouth and dry eye diseases.",1
2263,6,Is scuba diving safe during pregnancy?,"The different international federations and the Undersea and Hyperbaric Medical Society advise against scuba diving for pregnant women or those planning a pregnancy, but no randomized trials or trials provide a solid scientific basis.",0
1068,8,Which clotting factor is inhibited by betrixaban?,"Betrixaban is a novel oral factor Xa inhibitor administered once daily, mostly excreted unchanged in the bile and with low (17%) renal excretion.",0
860,11,Is hypersensitivity to DNA crosslinking agents a hallmark of Fanconi anemia?,"Genetic or epigenetic inactivation of the pathway formed by the Fanconi Anemia (FA) proteins occurs in several cancer types, including head and neck squamous cell carcinomas (HNSCC), rendering the affected tumors potentially hypersensitive to DNA crosslinking agents.",0
3307,20,Which drugs are included in the drug LONSURF?,"Trifluridine/tipiracil ( Lonsurf ) is a fixed-dose combination tablet comprising trifluridine , an antineoplastic nucleoside analogue , and tipiracil , a thymidine phosphorylase inhibitor .",0
926,6,Is there a role for transcription factories in genome organization?,"Based on this analysis, we propose that transcription factories result from the aggregation of RNA polymerase II-containing pre-initiation complexes assembled next to each other in the nuclear space.",0
1242,31,Is nimodipine recommended for prevention of vasospasm in aneurysmal subarachnoid hemorrhage patients?,The incidence of symptomatic vasospasm was five of 33 patients in the fasudil group and nine of 32 patients in the nimodipine group.,0
1579,5,What is the role of Thyrotropin Releasing Hormone in the treatment of comatose patients?,"[Montirelin hydrate (NS-3), a TRH analog, improved the disturbance of consciousness caused by head concussion and pentobarbital in mice].",1
851,18,Describe the mechanism of action of aliskiren. ,"With its unique mechanism of action, combining aliskiren with another RAAS-blocking agent that has a different mechanism of action may provide more comprehensive blockade of the RAAS, potentially conferring additional clinical benefits",0
2724,12,What phenotype is associated with the V60L mutation in the human MC1R gene?,"We describe a minisequencing protocol for screening DNA samples for the presence of 12 mutations in the human melanocortin 1 receptor gene (MC1R), eight of which are associated with the red hair phenotype.",1
3321,35,Is there a vaccine for rotavirus?,The monovalent rotavirus vaccine RIX4414 (Rotarix™) is administered as a two-dose oral series in infants and has demonstrated protective efficacy against RVGE in clinical trials conducted in developed countries.,0
3329,35,Rachmilewitz Index is used for which diseases?,"Rachmilewitz scoring system (endoscopic activity index [EAI]) was used to determine UC activity, and as for CD activity, CD activity index (CDAI) scoring was used.",0
1374,1,Which mechanisms underlie adaptive mutagenesis (stationary-phase mutagenesis) in Bacillus subtilis?,"the B. subtilis' ability to accumulate chromosomal mutations under conditions of starvation is influenced by cell differentiation and transcriptional derepression, as well as by proteins homologous to transcription and repair factors.",1
884,8,Which histone modifications are correlated with transcription elongation?,"Overall, our results show and suggest that multiple H4, H2A, and H3 residues contribute to and form a Set2 docking/recognition site on the nucleosomal surface so that proper Set2-mediated H3 Lys(36) di- and trimethylation, histone acetylation, and transcriptional elongation can occur.",0
554,12,What is the biological role of K-48 linked protein ubiquitination?,NF-κB and ubiquitylation initially became linked when it was recognised that lysine (K)48-linked ubiquitin chains are involved in the processing of NF-κB precursors and the degradation of inhibitor of kappa B (IκB) proteins,1
1551,4,Can we use platelet biomarkers to study Alzheimer's disease?,"Those include platelet-related disorders, such as storage pool disease, gray platelet syndrome, and Quebec platelet disorder; diseases where unwanted platelet activation is highly relevant, such as thrombosis and cardiovascular disease; and other diseases, such as cystic fibrosis, uremia, or Alzheimer's disease.",1
1171,2,Is nicotinamide effective for skin cancer prevention?,"Similar differences were found between the nicotinamide group and the placebo group with respect to new basal-cell carcinomas (20% [95% CI, -6 to 39]lower rate with nicotinamide, P=0.12) and new squamous-cell carcinomas (30% [95% CI, 0 to 51] lower rate, P=0.05).",0
1110,4,Describe Malgaigne fracture.,"Pelvic fractures, especially those of a Malgaigne type, frequently occur in patients who are polytraumatized.",1
1913,53,Is avanafil indicated for treatment of erectile dysfunction?,We evaluated the safety and efficacy of 100 and 200 mg avanafil for the treatment of adult males with erectile dysfunction after bilateral nerve sparing radical prostatectomy.,0
