qid,sentid,question,sentence text,label
2450,3,What is BBCAnalyzer?,"Thereby, the tool provides a straightforward solution for evaluating any list of expected mutations like hotspot mutations, or even whole regions of interest.",0
3249,12,Which receptor is inhibited by bimagrumab?,"This study aimed to explore the clinical potential of bimagrumab , a human monoclonal antibody targeting the activin type II receptor , for the recovery of skeletal muscle volume from disuse atrophy using an experimental model of lower extremity immobilization",0
95,18,Does the CTCF protein co-localize with cohesin?,Recent experiments have revealed that cohesin binds to the same sites in mammalian genomes as the zinc finger transcription factor CTCF,0
1715,0,Name triad of Wernicke encephalopathy.,"In the classical form it is characterized by a typical triad (confusion, oculomotor disturbance and ataxia), however, in the majority of the cases only confusion is present.",0
1100,1,Provide examples of how molecular transporters contribute to multi-drug resistance in bacteria.,"Overall, the phylogenetic diversity of As-resistant bacteria in underground water was very limited if compared with lentic and lotic waters.",1
2259,0,Does TUC.338 inhibit colorectal cancer?,TUC.338 promotes invasion and metastasis in colorectal cancer.,0
141,21,What is Genomicus?,"The Genomicus web server (http://www.genomicus.biologie.ens.fr/genomicus) is a visualization tool allowing comparative genomics in four different phyla (Vertebrate,",0
4127,3,What is BEL(Biological Expression Language) used for?,It is used in various situations to extract such knowledge and transform it into BEL networks.,0
1350,17,"Which are the bioinformatics tools for gene structure prediction?
","A crucial part in the gene structure prediction is to determine the precise exon-intron boundaries, i.e.",1
1754,21,Could BRCA gene test used for breast and ovarian cancer risk?,BRCA1 and BRCA2 genes are responsible for 5-10% of breast and ovarian cancer cases.,1
1825,15,What are PD-1 inhibitors?,PD-1 inhibits T cell proliferation by upregulating p27 and p15 and suppressing Cdc25A.,0
556,7,Which RNA polymerase is used for the replication of viroids?,Inhibition of alpha-amanitin-sensitive CEV synthesis in 200 mM (NH(4))(2)SO(4) resembles the reaction of RNA polymerase II on a free nucleic acid template,0
3649,8,Is SATB1 expressed in thymocytes?," We also demonstrate that GATA3, the key transcriptional regulator of αβ T cells positively regulates SATB1 expression in thymocytes suggesting an important role for SATB1 during T cell development.",0
3001,19,What is CardioClassifier?,"CardioClassifier integrates data retrieved from multiple sources with user-input case-specific information, through an interactive interface, to support variant interpretation.",1
3704,19,Does radiotherapy for prostate cancer increase bladder cancer risk?,"OBJECTIVE

Although it is well known that radiotherapy for prostate cancer increases comorbid rate of secondary bladder cancer, the effect of aging and smoking with radiotherapy on incidence rate of secondary bladder cancer remains unknown.",0
4021,14,Please list the 2 vaccines for herpes zoster(shingles),"recommending vaccination of adults 70 years of age (YOA) with the zoster vaccine live (ZVL), the only vaccine available at the time.",0
396,22,Which hormone abnormalities are common in Williams syndrome ?, This study confirms the presence of alterations of thyroid function in WS and also suggests the frequent occurrence of abnormalities of thyroid morphology in these patients.,1
3667,5,What is the target of galcanezumab?,"Introduction Galcanezumab is a humanized monoclonal antibody binding calcitonin gene-related peptide, used for migraine prevention.",1
2171,1,Is tirilazad effective for treatment of aneurysmal subarachnoid haemorrhage?,"During the treatment period, fewer patients developed delayed cerebral ischaemia in the tirilazad group than in the control group (OR 0.80, 95% CI 0.69 to 0.93).",0
3002,17,List clinical disorders or diseases where uc.189 is involved?,"Uc.189 might be considered as a novel molecule involved in ESCC progression, which provides a potential prognostic biomarker and therapeutic target.",1
4174,13,What percent of Rheumatoid Arthritis (RA) patients are not responding to anti-TNF therapy?,"These therapies are, however, expensive and 30% of patients fail to respond.",1
84,15,Is valproic acid effective for glioblastoma treatment?,Valproic acid use during radiation therapy for glioblastoma associated with improved survival,0
2269,0,What is the main focus of the CVE R/Bioconductor package?,CVE: an R package for interactive variant prioritisation in precision oncology.,1
2431,1,What is miravirsen?,the first miRNA-targeting drug Miravirsen for the treatment of hepatitis C has been successfully tested in clinical Phase II trials.,1
748,48,Which are the most common methods for gene prioritization analysis?,PINTA (available at http://www.esat.kuleuven.be/pinta/; this web site is free and open to all users and there is no login requirement) is a web resource for the prioritization of candidate genes based on the differential expression of their neighborhood in a genome-wide protein-protein interaction network,0
2442,17,Which genes belong to the AUX/IAA family of transcription repressors in plants?,"The Aux/IAA proteins are auxin-sensitive repressors that mediate diverse physiological and developmental processes in plants [1, 2].",1
2999,1,What is the percentage of individuals at risk of dominant medically actionable disease?,Our study shows that 1 in 38 healthy individuals (2.7%) has a (likely) pathogenic variant in one of 59 medically actionable dominant disease genes for which the American College of Medical Genetics and Genomics (ACMG) recommends disclosure.,1
1359,10,What is the role of TRH in hypertension?,"the encephalic renin-angiotensin system seems to be crucial in the development and/or maintenance of hypertension in SHR, we investigated the effect of antisense inhibition of TRH on that system and found that TRH antisense treatment significantly diminished the elevated diencephalic angiotensin II (Ang II) content in the SHR without any effect in control animals, suggesting that the Ang II system is involved in the TRH cardiovascular effects.",0
1516,4,Which peptide plays a pivotal role in human cystatin C fibrillization?,"This peptide was synthesized and self-assembled into amyloid-like fibrils in vitro, as electron microscopy, X-ray fiber diffraction, Attenuated Total Reflectance Fourier-Transform Spectroscopy and Congo red staining studies reveal.",1
3809,18,Which type of pluripotency is Otx2 associated with?,Induction of Otx2 causes the reorganization of acetylated Oct4 and results in the induction of the primed pluripotency gene network.,0
3981,10,Which transcription factor regulates emergency granulopoiesis?,"Upon infection, C/EBPβ was upregulated at the protein level in all the granulopoietic subpopulations.",0
1162,9,List features of the DEND syndrome.,We have verified a lack of clinical response for both glycemic control and neurological features in an infant with permanent neonatal diabetes mellitus and DEND syndrome due to a V59A mutation in the KCNJ11 gene.,0
876,5,Can fetal aneuploidy be detected with non-invasive prenatal testing?,SNP-based non-invasive prenatal testing detects sex chromosome aneuploidies with high accuracy.,0
876,44,Can fetal aneuploidy be detected with non-invasive prenatal testing?,"Maternal age alone is a poor minimum standard for prenatal screening for aneuploidy, and it should not be used a basis for recommending invasive testing when non-invasive prenatal screening for aneuploidy is available.",0
4162,2,Are somatic mutations positioned towards the nuclear periphery?,"For instance, smoking and UV-related signatures, as well as substitutions at certain motifs, were more enriched in the nuclear periphery.",1
3765,1,List the deadliest viruses in the world.,"The filoviruses, Ebola virus (EBOV) and Marburg virus (MARV), are among the deadliest viruses that cause disease in humans, with reported case fatality rates of up to 90% in some outbreaks.",1
1754,38,Could BRCA gene test used for breast and ovarian cancer risk?,"Genetic testing for BRCA genes, associated with hereditary breast-ovarian cancer risk, is an accepted cancer control strategy.",0
956,11,List programs suitable for pharmacophore modelling, pharmacophore model has been generated from the training set by means of the MOE (molecular operating environment) program.,1
3574,14,Which gene is frequently involved in autosomal dominant adult-onset demyelinating leukodystrophy (ADLD)?,"Duplication of the LMNB1 gene is the genetic cause of ADLD, yet the pathogenetic mechanism is not defined.",0
165,10,List markers for autophagy.,"the autophagy marker LC3,",0
1184,5,List the three most prevalent pathogenic species of Borrelia in Europe.,"There is limited understanding of large scale entomological risk patterns of B. miyamotoi and of Borreila burgdorferi sensu stricto (ss), the agent of Lyme disease, in western North America.",0
1213,8,Which is the major function of sororin?,"Sister chromatid cohesion, mediated by cohesin and regulated by Sororin, is essential for chromosome segregation.",1
72,13,Are transcribed ultraconserved regions involved in cancer?,"Most recent studies show that they are significantly altered in adult chronic lymphocytic leukemias, carcinomas, and pediatric neuroblastomas, leading to the hypothesis that UCRs may play a role in tumorigenesis and promising innovative future T-UCR-based therapeutic approaches",0
770,32,What is the function of the yeast protein Aft1?,Iron-responsive transcription factor Aft1 interacts with kinetochore protein Iml3 and promotes pericentromeric cohesin,0
684,0,Describe what is the advantage of using a stain free protein gel in a Western Blot experiment?,"V3 stain-free workflow for a practical, convenient, and reliable total protein loading control in western blotting.",1
1593,7,Which factors are considered in the ABCD2 score?,"ABCD2 (Age, Blood pressure, Clinical features, Duration, Diabetes) score and magnetic resonance imaging abnormalities help to identify patients at high risk of stroke.",1
3842,6,What is the reason for the abundance of operons in the genome of C. elegans?,"Recent evidence suggests that RNA polymerase is poised at the promoters of growth genes, and operons allow more efficient recovery from growth-arrested states, resulting in reduction in the need for this cache of inactive RNA polymerase.",1
1032,14,Is there association of matrix metalloproteinases with behaviour of pituitary adenomas?,It was higher in invasive macroprolactinomas (P = 0.003) when compared with noninvasive macroprolactinomas or the normal anterior pituitary gland.,0
71,4,Which human genes are more commonly related to craniosynostosis?,Syndromic craniosynostosis due to complex chromosome 5 rearrangement and MSX2 gene triplication,0
2496,9,Does prolactinoma increase osteoporosis risk?,We emphasize and highlight the importance of hyperprolactinemia and fractures caused by high prolactin levels.,0
2028,0,Which bacteria cause diphtheria?,Corynebacterium ulcerans is a zoonotic pathogen that can produce diphtheria toxin and causes an illness categorized as diphtheria in the European Union because its clinical appearance is similar to that of diphtheria caused by Corynebacterium diphtheriae.,0
2949,3,What is the mechanism of action of cemiplimab?,The FDA greenlighted the PD-1 inhibitor cemiplimab to treat patients with metastatic or locally advanced cutaneous squamous cell carcinoma who are not candidates for surgery or radiation.,1
2272,20,What is the origin of XUT transcripts in yeast?,We propose that NMD buffers genome expression by discarding pervasive regulatory transcripts.,0
3770,12,Describe the mechanism of action of pitolisant.,"rug, pitolisant, acts as an inverse agonist/antagonist at the H3 receptor, thus increasing histaminergic tone in the wake promoting system of the brain.",1
140,115,In which proteins is the chromodomain present?,"Here we report that the chromodomain-containing protein CDYL specifically recognizes di- and tri-methylated H3K27 (H3K27me2 and H3K27me3) and directly interacts with EZH2, the catalytic subunit of PRC2.",0
686,3,Which enzyme is inhibited by a drug fostamatinib?,"Fostamatinib, a Syk-kinase inhibitor, does not affect methotrexate pharmacokinetics in patients with rheumatoid arthritis.",0
643,16,In what type(s) of plant organelles we can detect prolamellar bodies?,The highest specific activity of the enzyme in etiolated leaf tissue was confirmed to be in the fraction of prolamellar bodies.,0
1443,10,What are the reported adverse effects of topical minoxidil?,Patients suffering from allergic contact dermatitis may benefit from patch testing to determine the causative allergen.,0
3981,39,Which transcription factor regulates emergency granulopoiesis?,"RORC1 orchestrates myelopoiesis by suppressing negative (Socs3 and Bcl3) and promoting positive (C/EBPβ) regulators of granulopoiesis, as well as the key transcriptional mediators of myeloid progenitor commitment and differentiation to the monocytic/macrophage lineage (IRF8 and PU.1).",0
1759,0,"What is FFI, fatal familial insomnia",Fatal familial insomnia is a rare disease caused by a D178N mutation in combination with methionine (Met) at codon 129 in the mutated allele of PRNP (D178N-129M haplotype).,1
2082,7,Andexanet Alfa is an antidote of which clotting factor inhibitors?,"In Phase III trials in healthy volunteers, andexanet alfa reduced anti-FXa activity by more than 90%, reduced the concentration of unbound direct FXa inhibitor, and inhibited thrombin generation.",0
2322,0,Which drugs were tested in the KEYNOTE-006 study?,The model used Kaplan-Meier estimates of progression-free survival and overall survival from a recent randomized phase 3 study (KEYNOTE-006) that compared pembrolizumab and ipilimumab.,0
1301,57,Which drug should be used as an antidote in benzodiazepine overdose?,"In intensive care medicine, the antagonist may be used in the treatment of benzodiazepine overdose as well as in the differential diagnosis of a coma of unknown origin.",1
2894,4,What is ferroptosis?,Ferroptosis is a form of oxidative cell death and has become a chemotherapeutic target for cancer treatment,1
3324,0,Which domain of the MOZ/MYST3 protein complex associates with histone H3?,"In conclusion, our data show that Moz regulates H3K9 acetylation at Hox gene loci and that RA can act independently of Moz to establish specific Hox gene expression boundaries.",1
1199,19,What is the disorder in which mutations in U4atac snRNA are detected?,"In this report, we establish a mechanistic basis for MOPD I disease and show that the inefficient splicing of genes containing U12-dependent introns in patient cells is due to defects in minor tri-snRNP formation, and the MOPD I-associated RNU4ATAC mutations can affect multiple facets of minor snRNA function",0
1931,34,What are Septins?, Septins are members of a conserved family of GTPases found in organisms as diverse as budding yeast and mammal,0
748,0,Which are the most common methods for gene prioritization analysis?,We developed a new network inference algorithm called the Knowledge Network Gene Prioritization (KNGP) algorithm which can incorporate both link and node knowledge,1
2976,0,What is the role of the Mcm2-Ctf4-Polα axis?,The Mcm2-Ctf4-Polα Axis Facilitates Parental Histone H3-H4 Transfer to Lagging Strands.,1
1376,5,Which are the enzymes involved in the control of tubulin acetylation?,"Moreover, acetylation of α-tubulin is under the control of the acetyltransferase MEC-17 and deacetylases SIRT2 (Sirtuin 2) and HDAC6 (histone deacetylase 6).",1
43,11,What is evaluated using the EORTC QLQ – INFO25 questionnaire?,The EORTC QLQ-INFO25 was used to evaluate the perceived level of and satisfaction with information.,1
892,16,List diseases where protein citrullination plays an important role.,This study suggests that accumulated citrullinated proteins and abnormal activation of PAD2 may function in the pathogenesis of prion diseases and serve as potential therapeutic targets.,0
3381,1,"Before 2019, what neurologic diseases are associated with the tau protein?",The hypothetical roles of arsenic in multiple sclerosis by induction of inflammation and aggregation of tau protein: A commentary,1
1399,6,What causes erucism?,Erucism is defined as urtication by Lepidoptera larvae.,1
1161,2,How does ranolazine affect kinase signaling activation in the heart?,Such changes were related to enhanced Ca(2+)/calmodulin kinase II (CaMKII) activity and increased phosphorylation of its targets.,1
1869,4,Which is the enzymatic activity of OTULIN?,"Two of them, OTULIN and CYLD,",0
3689,2,Which receptor is modulated with Siponimod?,Sphingosine 1-phosphate (S1P1 ) modulators provide an emerging therapeutic approach for various autoimmune disorders such as multiple sclerosis and psoriasis.,0
4227,58,What conditions are diagnosed using the scratch collapse test?,odiagnostic testing.,0
2891,4,What is the aim of the METABRIC project?,"Towards the development of robust strategies, we designed an iterative approach to consistently discriminate intrinsic subtypes and improve class prediction in the METABRIC dataset",0
3699,4,What is the use of erenumab?,"Conclusions As a preventive treatment of episodic migraine, erenumab at a dosage of 70 mg monthly significantly reduced migraine frequency and acute migraine-specific medication use.",0
4003,0,What is Hikikomori syndrome?," Hikikomori, from the Japanese words 'hiku' (to pull) and 'komoru' (to withdraw), is a clinical condition in which a subject locks himself/herself into his/her own house for more than 6 months.",1
1250,10,Against which organisms has reverse vaccinology been used?,"Ehrlichia ruminantium is an obligate intracellular bacterial pathogen which causes heartwater, a serious tick-borne disease of ruminants throughout sub-Saharan Africa",0
1916,14,What is Bexsero?,"Proteinaceous meningococcal B vaccines are under development, and the most advanced, Bexsero, is currently being evaluated by the European Medicines Agency.",0
4056,31,What is the target of adalimumab?,Adalimumab is a human monoclonal antibody which targets tumor necrosis factor (TNF)-alpha.,1
3051,2,What is the function of Taraxasterol  in rheumatoid arthritis?,These observations indicate that the protective effect of taraxasterol against rheumatoid arthritis is mediated via the modulation of inflammatory responses in mice.,1
114,11,Do archaeal genomes contain one or multiple origins of replication?,"We have used a combination of genetic, biochemical, and bioinformatic approaches to map DNA replication origins in H. volcanii.",0
1910,20,Could plasmepsins be used as targets for developing anti-malaria drugs?,"As inhibition of plasmepsins leads to the parasite's death, these enzymes can be utilized as potential drug targets.",0
2890,6,Which microRNA is the mediator of the obesity phenotype of patients carrying 1p21.3 microdeletions?,CONCLUSIONS This study showed that dosage effects of MIR137 are associated with 1p21.3 microdeletions and may therefore contribute to the ID phenotype in patients with deletions harbouring this miRNA.,0
261,9,Which enzyme deficiency can cause GM1 gangliosidoses?,"The lymphocytes, transformed lymphocytes and cultured skin fibroblasts of the patient were demonstrated to have severe beta-D-galactosidase deficiency",0
3039,6,Cerliponase alfa is apprived for treatment of which disease?,"CLN2 is characterised by progressive impairment of motor function, language deficiencies, seizures, ataxia, blindness and early death, and intracerebroventricular infusion of cerliponase alfa has been shown to reduce the progression of functional decline.",0
1747,47,Willis-Ekbom disease is also known as?,Willis-Ekbom Disease or Restless Legs Syndrome?,0
2478,8,Is there an association between Klinefelter syndrome and breast cancer?,"Patients with 47, XXY karyotype (Klinefelter syndrome) appear to have increased risk of developing cancer, especially male breast cancer, germ cell tumours and non Hodgkin lymphomas, but rarely acute myeloid leukaemia.",1
1110,18,Describe Malgaigne fracture.,"This problem was first described by Malgaigne in 1857 in his classic article on double vertical fractures of the pelvis, in which he described a 34-year-old woman with a pelvic fracture who subsequently died during childbirth",0
3014,13,"Erenumab, used to treat migraine headaches, binds to what protein?","CGRP receptor antagonists such as ubrogepant are effective for acute relief of migraine headache, whereas monoclonal antibodies against CGRP (eptinezumab, fremanezumab and galcanezumab) or the CGRP receptor (erenumab) effectively prevent migraine attacks.",1
1110,20,Describe Malgaigne fracture.,Another less frequently reported complication of pelvic fractures is the potential association with pregnancy and subsequent childbirth.,0
1397,0,Which drugs are included in TAS-102?,"PURPOSE: Trifluridine (TFT) is an antitumor component of a novel nucleoside antitumor agent, TAS-102, which consists of TFT and tipiracil hydrochloride (thymidine phosphorylase inhibitor).",1
1675,28,List inhibtors targeting the mitochondrial permeability transition pore.,Bradykinin prevents reperfusion injury by targeting mitochondrial permeability transition pore through glycogen synthase kinase 3beta.,0
1161,3,How does ranolazine affect kinase signaling activation in the heart?,"Ranolazine at therapeutic concentrations partially reversed the HCM-related cellular abnormalities via I(NaL) inhibition, with negligible effects in controls.",0
4068,11,What are the two types of duplicated genes in the yeast S. cerevisiae?,iae genome.,0
3321,41,Is there a vaccine for rotavirus?,Rotarix significantly reduced rotavirus gastroenteritis episodes and rotavirus-related hospitalizations in vaccinated infants compared with placebo recipients (P < 0.05).,0
3788,12,Is Semagacestat effective for Alzheimer's Disease?,Recently disclosed Phase III findings on semagacestat indicated that Alzheimer's disease (AD) patients on this drug showed significantly worsened cognitive function compared to those treated with placebo.,0
157,20,Which mutations of phopspholamban have been found in patients with cardiomyopathy?,The genetic analysis was focused on R9C mutation with the ability to block PLN phosphorylation leading to chronic inhibition of SERCA2a activity.,0
1909,10,What is the target of tanezumab?,"In preclinical studies, tanezumab, and its murine precursor muMab-911, effectively targeted the NGF pathway in various chronic and inflammatory pain models.",0
1220,21,Which disease is treated with Eliglustat?,"However, the extended use of eliglustat and related compounds for the treatment of glycosphingolipid storage diseases with CNS manifestations is limited by the lack of brain penetration of this drug.",0
880,24,What is known about maternal smoking and brain tumor risk?,No association was found between the risk of CBTs and maternal or paternal smoking before pregnancy and there was no association between CBTs and maternal smoking during pregnancy [odds ratio (OR) = 0.98; 95% confidence interval (CI) = 0.72-1.3].,1
2906,0,What is the function of Plasminogen activator inhibitor 1?,Plasminogen activator inhibitor-1 (PAI-1) is an important physiological inhibitor of tissue-type plasminogen activator (tPA) and plays a critical role in fibrinolysis.,1
1347,14,Is the protein product of the cylindromatosis gene (CYLD) a deubiquitinating enzyme?,Loss of the deubiquitinating activity of CYLD is correlated with tumorigenesis.,0
2201,14,What is the role of DNA Repair Cofactors ATMIN and NBS1?,DNA Repair Cofactors ATMIN and NBS1 Are Required to Suppress T Cell Activation.,0
4153,1,Which drugs are included in the MAID chemotherapy regimen for sarcoma?,"PATIENTS AND METHODS: Advanced STS patients aged 18-65 years received four courses of standard mesna, adryamycin, ifosfamide and dacarbazine (MAID) treatment.",0
1001,41,Which type of cell death is known as anoikis?,"As a barrier to metastasis, cells normally undergo an apoptotic process known as ""anoikis,"" a form of cell death due to loss of contact with the extracellular matrix or neighboring cells",0
2169,4,Which class of genes are mutated in Diamond Blackfan Anemia patients?,A transgenic mouse model demonstrates a dominant negative effect of a point mutation in the RPS19 gene associated with Diamond-Blackfan anemia,0
422,10,How effective is the dentritic cells treatment on cancer?,"Notoriously in patients with severe anal intraepithelial neoplasia, the density of CD1a+ epithelial dendritic cells was influenced by the viral load of HIV-1.",0
4119,44,Can propofol cause green urine?,A,0
1026,0,Which is the neurodevelopmental disorder associated to mutations in the X- linked gene mecp2?,Rett syndrome is caused by mutations in the gene coding for methyl CpG-binding protein 2 (MeCP2).,1
1865,27,Is adalimumab effective for hidradenitis suppurativa?,Effective long-term control of refractory hidradenitis suppurativa with adalimumab after failure of conventional therapy.,0
1282,2,How does Rif1 regulate DNA replication?,"In contrast, human Rif1 did not accumulate at functional telomeres, but localized to dysfunctional telomeres and to telomeric DNA clusters in ALT cells, a pattern of telomere association typical of DNA-damage-response factors.",0
1654,10,What is the function of the MTH1 enzyme in cancer cells?,"These results indicate that all three of the human MTH1, MTH2, and NUDT5 proteins act as a defense against the mutagenesis induced by oxidized dGTP.",1
