qid,sentid,question,sentence text,label
2165,13,Which NGS alignment software implement the Burrows-Wheeler Transform?,"Therefore, in this paper, we introduce Burrows-Wheeler Aligner's Smith-Waterman Alignment on Parallel MapReduce (BWASW-PMR) cloud platform for long sequence alignment.",1
301,32,Which oncogenes are able to induce cellular senescence?,Expression of caveolin-1 induces premature cellular senescence in primary cultures of murine fibroblasts,0
1021,17,"In which process Src, Cortactin and MT1-MMP are playing an essential role?","Small interfering RNA (siRNA) inhibition established that organization of invadopodia structure requires cortactin, whereas protease inhibitor studies identified membrane type 1 matrix metalloproteinase (MT1-MMP) as the key invadopodial enzyme responsible for gelatin matrix degradation in the breast carcinoma cell line MDA-MB-231.",1
1162,22,List features of the DEND syndrome.,"Five patients with developmental delay, epilepsy and neonatal diabetes (DEND) syndrome had unique mutations not associated with other phenotypes.",0
1018,25,What is the Timothy syndrome?,The gain-of-function mutations were found at two mutually exclusive exons in patients with Timothy syndrome (TS).,0
3250,6,Where is the yeast transpozable element Ty3 preferentially inserted?,"Ty3 was shown to insert upstream of tRNA, 5S, and U6 genes, all of which are transcribed by RNA polymerase III",0
2525,2,Which package in Bioconductor has been developed with the aim to analyze differential DNA loops from sequencing data?,"To systematically assess changes in DNA looping architecture between samples, we introduce diffloop, an R/Bioconductor package that provides a suite of functions for the quality control, statistical testing, annotation, and visualization of DNA loops.",1
3073,15,Is the NLM medical text indexer (MTI) still useful and relevant?,"12 years on - Is the NLM medical text indexer still useful and relevant?Based on our findings, yes, MTI is still relevant and useful, and needs to be improved and expanded.",1
2050,1,Is Dupilumab used for treatment of atopic dermatitis?,"Background Dupilumab, a human monoclonal antibody against interleukin-4 receptor alpha, inhibits signaling of interleukin-4 and interleukin-13, type 2 cytokines that may be important drivers of atopic or allergic diseases such as atopic dermatitis.",0
1770,20,What is the mechanism of action of peginesatide?,"Peginesatide, a polyethylene glycol (PEG)ylated peptide-based erythropoiesis-stimulating agent, stimulates the erythropoietin receptor dimer that governs erythropoiesis.",0
3904,56,Is Ixodes a species of tick?,"A list of the 70 species of Australian ticks; diagnostic guides to and species accounts of Ixodes holocyclus (paralysis tick), Ixodes cornuatus (southern paralysis tick) and Rhipicephalus australis (Australian cattle tick); and consideration of the place of Australia in the evolution of ticks with comments on four controversial ideas.",0
777,12,Which pituitary adenoma is common cause of infertility is women?,"Of the other three patients, one showed evidence of bilateral tubal occlusion secondary to pelvic inflammatory disease, one has had a right ectopic pregnancy followed by two abortions, and the third patient was found to have a pituitary adenoma.",0
3307,21,Which drugs are included in the drug LONSURF?,TAS-102 ( Lonsurf ) is an oral fluoropyrimidine that is formed by the combination of 2 active drugs: trifluridine ( a nucleoside analog ) and tipiracil hydrochloride ( a thymidine phosphorylase inhibitor) .,0
2298,11,Which gene is the paralog of yeast UPC2?,Ecm22 and Upc2 positively regulate basal expression of PRM1 and PRM4.,0
1401,22,Which enzyme is deficient in Krabbe disease?,The inherited deficiency of galactosylceramide beta-galactosidase (E.C.,0
3742,17,Han Wistar and Sprague Dawley are breeds of what laboratory animal?,Similarities were found b,0
285,14,Is ospemifene effective for treatment of dyspareunia?,Clinical trials have confirmed that daily doses are well-tolerated and that it is effective in normalizing vaginal maturation index and pH as well as improving the symptoms associated with VVA including dyspareunia.,0
3755,14,What is the function of the zelda transcription factor in D. melanogaster?,Zelda overcomes the high intrinsic nucleosome barrier at enhancers during Drosophila zygotic genome activation.,0
2943,7,Describe Canvas SPW,Availability and implementation Canvas SPW is available for download from https://github.com/Illumina/canvas.,0
1443,5,What are the reported adverse effects of topical minoxidil?,The patients tolerated treatment with 1% topical minoxidil well without significant adverse effects.,0
397,8,"The secreted frizzled-related protein 3 (sFPR3) is altered in human cancers.
Are its level found to increase or to decrease?",All these cases were associated with either up-regulation of FzE3 or down-regulation of hsFRP,0
1299,29,"Which tumor suppressor is referred to as ""the guardian of the genome""?","The tumor suppressor protein, p53, is often referred to as the guardian of the genome.",0
440,17,Which are the main causes of fetal echogenic bowel?,"strongly associated with adverse pregnancy outcome due to utero-placental insufficiency, particularly in women with elevated maternal serum alpha-fetoprotein concentration due to severe feto-maternal bleeding",0
1074,0,Which ones are the ESKAPE organisms?,"The aim of this study was to test in the clinic whether antimicrobial diversity affects resistance of Enterococcus faecium, Staphylococcus aureus, Klebsiella species, Acinetobacter baumannii, Pseudomonas aeruginosa, and Enterobacter species (ESKAPE) pathogens in ventilator-associated pneumonia (VAP).",0
150,3,Is PTEN involved in follicular thyroid carcinoma?,"Similarly, there is increasing evidence demonstrating that mutations leading to activation of the phosphatidylinositol 3- kinase (PI3K)/AKT effectors -PTEN and PI3KCa- are essential for the pathogenesis of follicular thyroid carcinoma (FTC)",0
1635,3,How can the expression of SerH3 immobilization antigen be regulated?,Expression of each allele is regulated by temperature-sensitive mRNA stability.,0
1916,29,What is Bexsero?,Modelled evaluation of multi-component meningococcal vaccine (Bexsero®) for the prevention of invasive meningococcal disease in infants and adolescents in the UK.,0
705,24,Is Bladder training an effective method to treat  urge incontinence ?,"RESULTS: After 3 months the mean frequency of urine loss per week diminished from 21 to 8, and after 12 months to 6 times.",0
3320,11,What is the link between dental x-ray and brain tumor risk?,"CONCLUSION

Our finding of a total lack of correlation between benign brain tumors and markers of oral health and, by implication, dental X-rays, suggests there may be no relationship between dental X-rays and meningioma or other benign brain tumors.",0
701,21,Which antibody is implicated in the Bickerstaff's brainstem encephalitis?,This is the case of a 79-year-old man with chronic lymphocytic leukemia who presented with Guillain-Barré syndrome with features overlapping with the Miller Fisher syndrome and Bickerstaff brainstem encephalitis and positive antiganglioside GQ1b antibody about 6 months after treatment with bendamustine and rituximab.,0
457,60,Which molecule is targeted by a monoclonal antibody Mepolizumab?,"IL-5 antagonist therapies in current development include two monoclonal anti-IL-5 antibodies (mepolizumab, reslizumab), a monoclonal antibody directed at the IL-5 receptor (benralizumab), and anti-sense oligonucleotide therapy (TPI ASM8)",0
2476,30,Can canagliflozin cause euglycemic diabetic ketoacidosis?,Euglycemic Diabetic Ketoacidosis With Prolonged Glucosuria Associated With the Sodium-Glucose Cotransporter-2 Canagliflozin.,1
2278,2,List the two most important hematological features of the Evans syndrome,BACKGROUND: Autoimmune cytopenias are characterized by immune-mediated destruction of hematopoietic cell lines with immune thrombocytopenia (ITP) affecting platelets and Evans syndrome (ES) affecting platelets and red blood cells.,0
3132,32,Can you computationally predict Molecular Recognition Features (MoRFs) regions in Intrinsically Disordered Proteins (IDPs)?,These intrinsically disordered regions (IDRs) participate in binding events through regions called molecular recognition features (MoRFs).,0
609,17,What is transvection?,The same phenomenon appears to be responsible for pairing-dependent interallelic complementation at numerous other genes in Drosophila.,0
949,24,Do R-loops tend to form at sites of DNA replication?,"Immediately after infection, RNA-DNA hybrids (R-loops) occur on (at least some) replication origins, with the annealed RNA serving as a primer for leading-strand synthesis in one direction.",0
702,0,Which micro-RNAs have been associated in the pathogenesis of Rheumatoid Arthritis?,This study provides the first description of increased expression of miRNA miR-155 and miR-146a in RA,1
616,45,Is statin use associated with improved outcomes after aneurysmal subarachnoid hemorrhage?,The neuroprotective effects of acute treatment with pravastatin following aneurysmal SAH are associated with enhancement of autoregulation,0
3929,21,What genes is implicated in myotonic goats and other  nondystrophic myotonias?,Myotonic dystrophy Type 1 is caused by CTG repeat expansion in the 3' untranslated region in the Dystrophia Myotonica Protein Kinase (DMPK) gene.,0
500,9,Is the transcriptional regulator BACH1 an activator or a repressor?,"Bach1, the negative regulator of Nrf2",0
3320,1,What is the link between dental x-ray and brain tumor risk?,Dental x-rays and risk of meningioma.,0
1314,7,List bacteria that may be useful in uranium bioremediation.,Geobacteraceae,0
748,25,Which are the most common methods for gene prioritization analysis?,"vocabularies, representations and ranking algorithms for gene prioritization by text mining",0
1149,3,Which is the subcellular localization of the protein angiogenin?,"Under growth conditions, ANG is located in the nucleus",1
2187,20,Is edema a symptom of nephrotic syndrome?,"The patient was admitted with edema of both legs, and the nephrotic syndrome was discovered, leading to the diagnosis of AA amyloidosis on kidney biopsy.",0
224,0,How many genes does the human hoxD cluster contain?,Both children are heterozygous for a deletion that eliminates at least eight (HOXD3-HOXD13) of the nine genes in the HOXD cluster,1
701,3,Which antibody is implicated in the Bickerstaff's brainstem encephalitis?,"Serologic analysis of antibodies against ganglioside complexes (anti-GDIa, anti-GDIb, anti-GM1, anti-GM2, anti-GM3, anti-GQIb and anti-GTIb antibodies) showed negative results.",0
251,0,Proteomic analyses have revealed proteins associated with the triple-negative breast cancers. List some proposed proteins.,"Some of these proteins are of outstanding interest in the biology and clinical management of this disease, such as CD44 and PARP1.",1
1451,3,What is the main biological function of the CRISPR-CAS9 genome editing system?,"We have shown that homologous gene targeting is possible at 1-4% efficiency using this system, allowing for the construction of defined insertions and deletions.",0
1855,7,Which server is used for simulation of macromolecular diffusional association?,"webSDA allows users to run Brownian dynamics simulations with SDA to study bimolecular association and encounter complex formation, to compute association rate constants, and to investigate macromolecular crowding using atomically detailed macromolecular structures.",1
2547,0,What is the most common feature of the Doege–Potter syndrome?,We describe a patient with Doege-Potter syndrome (solitary fibrous tumor of the pleura presenting with hypoglycemia) and illustrate several important lessons learned from the case.,1
1154,13,What is known about the role of mHealth in the prevention of disease?,Participants were randomized to usual prenatal care plus text messaging or usual care alone.,0
1258,3,List fluorescent reporter proteins.,Flavin-based fluorescent proteins (FbFPs),0
2056,35,Is PUVA therapy indicated for eczema treatment?,OBJECTIVE: Our purpose was to assess the effectiveness of local bath-PUVA therapy in 28 patients with chronic palmar or plantar eczema or both who were resistant to conventional topical treatment.,0
675,1,Which multiple kinase inhibitors are used in cancer therapy?,"These inhibitors include ZD6474, SU11248, AEE 788, sorafenib, vatalanib, and AG-013736.",1
3767,9,Which transcription factor controls Drosophila's Hes genes?,These results suggest that Hes genes are functionally classified into two groups: those that are regulated by Notch and those that are not.,0
673,2,Does the protein mTOR regulate autophagy?,"Several pathways, including mTOR, have been shown to regulate autophagy.",0
543,8,Is the gene DUX4 epigenetically regulated in somatic cells?,"Induced pluripotent (iPS) cells also express full-length DUX4 and differentiation of control iPS cells to embryoid bodies suppresses expression of full-length DUX4, whereas expression of full-length DUX4 persists in differentiated FSHD iPS cells.",0
440,7,Which are the main causes of fetal echogenic bowel?,"Analyses were repeated after excluding cases of aneuploidy, cytomegalovirus (CMV) infection,",0
2013,18,What is the role of Laser Interstitial Thermal Therapy in glioma treatment?,"MRI-guided laser interstitial thermal therapy is currently used as a minimally invasive treatment for brain metastases, radiation necrosis, glioma, and epilepsy.",0
671,37,What is known about the Digit Ratio (2D:4D) cancer?,Low numbers of CAG repeats and low 2D:4D are both associated with high sperm numbers and protection against breast cancer.,0
1908,17,Which syndromes are associated with heterochromia iridum?,"BACKGROUND: Heterochromia iridis, asymmetry of iris pigmentation, has been well described with congenital Horner syndrome.",0
3844,12,What is marked by DNaseI hypersensitive sites?, regions of open chromatin [DNaseI hypersensitivity (DHS)],0
3783,1,List human antibody isotypes.,Human immunoglobulin D (IgD) occurs most abundantly as a membrane-bound antibody on the surface of mature B cells (mIgD).,1
104,8,Which is the genetic defect causing Neurofibromatosis type 1?,"Mis-sense, non-sense, frame-shift or splice-site mutations were identified across the entire gene of which the majority (45/68) were novel in nature.",0
1348,33,What is the characteristic domain of histone methyltransferases?,"the evolutionarily conserved SET domain, which requires adjacent cysteine-rich regions to confer histone methyltransferase activity",0
1499,13,What is an acceptable sequence coverage(depth) required for human whole-exome sequencing?,"We captured 162,073 exons of 16,954 genes and sequenced the targeted regions to a mean coverage of 56-fold.",0
2974,3,RV3-BB vaccine is used for prevention of which viral infection?,Molecular characterisation of rotavirus strains detected during a clinical trial of the human neonatal rotavirus vaccine (RV3-BB) in Indonesia.,0
1744,4,Which is the primary protein component of Lewy bodies?,"For alpha-synuclein, the major protein component of Lewy bodies associated with Parkinson's disease, we have used a combination of ssNMR and biochemical data to identify the key region for self-aggregation of the protein as residues 77-82 (VAQKTV).",0
1117,10,Which genes does thyroid hormone receptor alpha1 regulate in the heart?,"PE, in the absence of T3, resulted in 5.0 fold increase in TRalpha1 expression in nucleus and 2.0 fold decrease in TRalpha1 expression in cytosol, P<0.05.",0
2258,3,What is the FIRE (Functional Inference of Regulators of Expression) tool?,FIRE scores are also predictive of cis -eQTL SNVs across a variety of tissue types.,1
769,2,Which growth factors are known to be involved in the induction of EMT?,"Fibroblast growth factor receptor 1 is an oncoprotein that is involved in tumorigenesis, and PD173074 is known to be a selective inhibitor of FGFR1.",0
288,7,Can zinc finger nucleases be used to combat disease?,Zinc finger nucleases as tools to understand and treat human diseases.,1
3291,1,Is traditional Chinese medicine associated with a decreased risk of heart failure in breast cancer patients receiving doxorubicin treatment?, Using TCM significantly decreased the incidence of CHF in patients with breast cancer who received conventional chemotherapy with or without radiotherapy.,1
1608,6,"Elaborate on the potential efficacy of gemcitabine for the treatment of recurrent, platinum-resistant epithelial ovarian cancer.","Gemcitabine plus endostar significantly improved the prognosis in patients with platinum-resistant recurrent ovarian cancer, especially in those with malignant effusion",0
2913,5,Endolymphatic hydrops is associated with Meniere’s disease. Please provide a summary of endoymphatic hydrops including the symptoms and affected body part.,"Ménière's disease is associated with hydrops of the inner ear endolymphatic space, and histopathologically, the cochlea and vestibule are usually involved.",1
1640,9,Is Turcot syndrome associated with glioblastoma?," Biallelic mutations of MMR genes are associated with pediatric cancers, including glial tumors, in Turcot syndrome type 1 (TS1).",0
1929,41,Can NADPH oxidase be inhibited by apocynin and diphenylene iodonium?,"Our results showed that IL-1beta enhanced HTSMCs-monocyte adhesion through up-regulation of VCAM-1, which was inhibited by pretreatment with selective inhibitors of PKCalpha (Gö6976), c-Src (PP1), NADPH oxidase [diphenylene iodonium (DPI) and apocynin (APO)], intracellular calcium chelator (BAPTA/AM), PI-PLC (U73122), CaM (calmidazolium chloride), CaM kinase II (KN62), p300 (garcinol), NF-kappaB (Bay11-7082), HDAC (trichostatin A), and ROS scavenger [N-acetyl-L-cysteine (NAC)] or transfection w",0
2231,21,Is apremilast effective for psoriatic arthritis?,"No imbalance in major adverse cardiac events, serious or opportunistic infections, malignancies or laboratory abnormalities was observed.Apremilast was effective in the treatment of psoriatic arthritis, improving signs and symptoms and physical function.",0
3909,1,What does fingolimod do to the grey matter of the brain?,These results suggest a possible protective effect of fingolimod on focal and diffuse GM damage.,1
1289,28,List BRAF inhibitors that have been tested in clinical trials for treatment of melanoma patients,We conducted a systematic prospective dermatological review of all patients enrolled at a single institution in the phase I/II clinical trial of the mutant BRAF inhibitor dabrafenib (GSK2118436).,0
682,14,Is sumoylation implicated in myogenesis?,These novel results suggest that protein sumoylation plays a pivotal role in myoblast differentiation and is required to regulate the activity of key targets downstream of MyoD and myogenin.,1
3867,14,Which cancers can be treated with Selpercatinib?,This art,0
2247,1,Does TFIIS affect nucleosome positioning?,"The same nucleosomes transcribed in the opposite orientation form a weaker, more diffuse barrier that is largely relieved by higher salt, TFIIS, or FACT",1
2674,5,"What is ""enhancer hijacking""?",We demonstrate a novel approach for simultaneous detection of genomic rearrangements and enhancer activity in tumor biopsies.,0
4138,29,Is methotrexate used for the treatment of Rheumatoid Arthritis (RA)?,We enro,0
1329,20,Is p100 the precursor protein molecule of the NF-kappaB transcription factor subunit p50?,"NF-kappaB functions as a hetero- or homo-dimer which can be formed from five NF-kappaB subunits, NF-kappaB1 (p50 and its precursor p105), NF-kappaB2 (p52 and its precursor p100), RelA (p65), RelB and c-Rel",1
1362,9,Which protein is the main inhibitor of protein phosphatase 1 (PP1)?,"Thus, long-term cardiac specific overexpression of the protein phosphatase 1 inhibitor-1 and the associated increases in cardiac contractility appear to herald changes in a rather small number of proteins, which may reflect important compensatory adaptations in a hyperdynamic heart [corrected]",0
505,4,Which are the main methods for pharmacophore modelling?,We discuss the pharmacophore mapping methods that have been successfully employed in the discovery of first-in-class inhibitors.,0
1218,6,Which type of lung cancer is afatinib used for?,"In preclinical studies, afatinib not only inhibited the growth of models with common activating EGFR mutations, but was also active in lung cancer models harboring wild-type EGFR or the EGFR L858R/T790M double mutant.",0
88,0,Is fatigue prevalent in patients receiving treatment for glioblastoma?,"By contrast, fatigue worsened over time, with a difference in mean score of 5.6 points between baseline and 4-month follow-up (P=.02).",1
720,29,What causes Katayama Fever?,A 35-year-old man presented with fever and severe urticaria after visiting Uganda.,0
480,14,Are epigenetic modifications implicated in cardiovascular development and disease?,"Epigenetic modifications are heritable alterations of the genome, which can govern gene expression without altering the DNA sequence.",0
3957,12,Which diseases are associated with the Yaa gene?,"The accelerated development of systemic lupus erythematosus (SLE) in BXSB male mice is associated with the presence of an as yet unidentified mutant gene, Yaa (Y-linked autoimmune acceleration).",0
3232,33,Is subdural empyema a complication of sinusitis?,Subdural empyema is an uncommon but serious complication of sinusitis.,0
89,2,List two common features of Tay syndrome.,Cases without manifest ichthyosis are also identified as PBIDS.,0
469,6,What is the treatment of neuropathic pain in children?,Pregabalin is one of the first drugs registered for the treatment of neuropathic pain.,1
3931,3,Is cadherin a plasma membrane marker?,"E-cadherin, a central component of the adherens junction (AJ), is a single-pass transmembrane protein",1
1781,14,What molecule is targeted by Avelumab?,"Systemic Immunotherapy of Non-Muscle Invasive Mouse Bladder Cancer with Avelumab, an Anti-PD-L1 Immune Checkpoint Inhibitor.",0
2444,18,List the ten types of conjoined twins.,"RESULTS Three sets of female conjoined twins underwent successful separation 2 pygopagus, one ischiopagus tripus) with 5 surviving infants.",0
806,38,Which enzyme is involved in the maintenance of DNA (cytosine-5-)-methylation?,DNA methylation is catalyzed by a family of DNA methyltransferases (DNMTs) including the maintenance enzyme DNMT 1 and de novo methyltransferases DNMT 3a and DNMT 3b.,0
1015,13,List tele monitoring applications of miniaturised sensors,"Patients in the intervention arm transmitted weekly blood pressure readings wirelessly, using adapted sensors via mobile phones to a central server.",0
2232,46,Is there any role of TBR1 in autism?,TBR1 regulates autism risk genes in the developing neocortex.,0
2772,3,What is the mechanism of action of Brigatinib?,"Comparison between ALK-brigatinib and ALK-crizotinib suggests that the scaffold of brigatinib is well anchored to the residue Met1199 of hinge region by two hydrogen bonds, and the residue Lys1150 has the strong electrostatic interaction with the dimethylphosphine oxide moiety in brigatinib.",0
1330,10,What is the definition and the biological role of epithelial-mesenchymal transition (EMT),"Therefore, the definition of this phenotype is of great clinical interest.",0
3600,1,Which de novo mutation in FGFR cause achondroplasia?,"More than 90% of cases are sporadic and there is an increased paternal age at the time of conception of affected individuals, suggesting that de novo mutations are of paternal origin.",0
2442,12,Which genes belong to the AUX/IAA family of transcription repressors in plants?,"Auxin dose-response assays revealed that IAA9 downregulated lines were hypersensitive to auxin, although the only early auxin-responsive gene that was found to be upregulated in the antisense lines was IAA3",0
3836,8,The NoSAS Score can be used for screening of which disorders?,The NoSAS score and the SBQ questionnaire have a moderate performance in diagnosing OSAHS.,0
1237,18,Has the protein GFP been used in transgenesis for live protein imaging?,"Typically transgenes are generated by placing a promoter upstream of a GFP reporter gene or cDNA of interest, and this often produces a representative expression pattern.",0
938,8,Which are the main functions of the APOBEC3 family of proteins?,Foamy virus Bet proteins function as novel inhibitors of the APOBEC3 family of innate antiretroviral defense factors.,1
825,7,"Could Catecholaminergic Polymorphic Ventricular Tachycardia (CPVT)
cause sudden cardiac death?","Although rare, CPVT is suspected to cause a substantial part of sudden cardiac deaths in young individuals.",0
1617,15,What are the skeletal muscle satellite cells?,"Satellite cell-derived muscle precursor cells may be used to repair and regenerate damaged or myopathic skeletal muscle, or to act as vectors for gene therapy.",0
929,10,What type of enzyme is peroxiredoxin 2 (PRDX2)?,Human erythrocyte peroxiredoxin 2 (Prx2) is a typical 2-cys cytosolic peroxiredoxin with thiol-dependent hydrogen peroxide scavenger activity.,0
551,14,Which receptors are bound by Tasimelteon?,"Results indicate that tasimelteon is a potent Dual Melatonin Receptor Agonist (DMRA) with 2.1-4.4 times greater affinity for the MT2 receptor believed to mediate circadian rhythm phase-shifting (Ki = 0.0692 nM and Ki = 0.17 nM in NIH-3T3 and CHO-K1 cells, respectively), than for the MT1 receptor (Ki = 0.304 nM and Ki = 0.35 nM, respectively).",0
